{
  "version": 1,
  "study_session_id": "5b1b6f0e-8c0e-4e5a-9a37-7a0e6d6f1c12",
  "units": [
    {
      "unit_id": "0d3c6b52-4e0a-4d0b-8a8e-3f1d7c1c9a55",
      "title": "Ty the",
      "summary": "Ty the la noi hop ho hap te bao.",
      "kind": "concept",
      "section_id": null,
      "lineage": [],
      "single_source": true,
      "anchors": [
        {
          "source": "document",
          "document_id": "11111111-1111-1111-1111-111111111111",
          "page_no": 3,
          "start": 0,
          "end": 24,
          "quote_text": "Mitochondria are the site"
        }
      ]
    },
    {
      "unit_id": "7a1f2c3d-4b5e-4f60-8a71-92b3c4d5e6f7",
      "title": "Chu trinh Krebs",
      "summary": "Ty the la noi hop ho hap te bao.",
      "kind": "concept",
      "section_id": null,
      "lineage": [],
      "single_source": true,
      "anchors": [
        {
          "source": "document",
          "document_id": "11111111-1111-1111-1111-111111111111",
          "page_no": 3,
          "start": 0,
          "end": 24,
          "quote_text": "Mitochondria are the site"
        }
      ]
    }
  ],
  "merges": [],
  "questions": [
    {
      "unit_ids": [
        "0d3c6b52-4e0a-4d0b-8a8e-3f1d7c1c9a55",
        "7a1f2c3d-4b5e-4f60-8a71-92b3c4d5e6f7"
      ],
      "level": 3,
      "prompt": "Ty the va chu trinh Krebs lien he the nao?",
      "reference_answer": "Chu trinh Krebs dien ra trong ty the.",
      "rubric": "Noi hai y voi nhau."
    }
  ],
  "dropped": {
    "anchors": 0,
    "units": 0,
    "questions": 0
  },
  "skipped": [
    {
      "kind": "note",
      "ref": 1,
      "reason": "needs_ocr"
    }
  ]
}
